pattern_id,name,category,decision_criteria,signals,intent,variants,decision_questions,web_queries,verification_gate,dependencies,conflicts,skill_level_notes,related_fragments,consolidated_guide,section_anchor,phase
model-versioning,Model Versioning,ai-lifecycle,Use when: model registry and versioning,"version control,model registry,tenant model mapping",Model registry and versioning,semantic;timestamp;hash-based;hybrid,Version scheme for models?;Tenant-specific models?;Model lineage tracking?,ML model versioning best practices {date};model registry patterns {date},QG-M3,model-fine-tuning,,Basic: Semantic versioning;Advanced: Full lineage with tenant mapping,llmops;model-fine-tuning-guide,ai-lifecycle-patterns-guide.md,model-versioning,solutioning
llm-cost-tracking,Llm Cost Tracking,cost-optimization,Use when: llm cost attribution and tracking,"token metering,cost attribution,budget alerts",LLM cost attribution and tracking,per-request;per-session;per-tenant;aggregate,Cost attribution granularity?;Real-time vs batch tracking?;Budget alert thresholds?,LLM cost tracking multi-tenant {date};AI cost optimization {date},QG-P1,usage-metering,,Basic: Per-request token counting;Advanced: Full cost attribution with allocation,llm-cost-optimization-guide;usage-metering,cost-patterns-guide.md,llm-cost-tracking,production
token-budgeting,Token Budgeting,cost-optimization,Use when: token budget enforcement,"per-tenant limits,budget enforcement,overage handling",Token budget enforcement,hard-limit;soft-limit;throttle;burst-allowance,Budget enforcement strategy?;Overage handling?;Per-tier limits?,token budget management {date};LLM usage quotas {date},QG-P1,llm-cost-tracking,,Basic: Hard limits per tenant;Advanced: Adaptive budgets with burst,llm-cost-optimization-guide;quota-management,cost-patterns-guide.md,token-budgeting,production
prompt-catalog,Prompt Catalog,ai-lifecycle,Use when: prompt library management,"prompt versioning,tenant prompts,prompt testing",Prompt library management,centralized;distributed;hybrid;tenant-specific,Prompt organization strategy?;Version control approach?;A/B testing needed?,prompt management systems {date};prompt library patterns {date},QG-M3,ai-runtime,,Basic: Centralized catalog;Advanced: Tenant-specific with inheritance,prompt-catalog-guide;llmops,ai-lifecycle-patterns-guide.md,prompt-catalog,solutioning
vector-database,Vector Database,ai-lifecycle,Use when: design vector database architecture for multi-tenant ai,"vector storage,semantic search,embeddings persistence",Design vector database architecture for multi-tenant AI,pinecone;weaviate;qdrant;pgvector;milvus,What scale of vectors expected?;Tenant isolation for vectors?;Real-time vs batch indexing?,vector database multi-tenant {date};embedding storage patterns {date};pgvector vs dedicated vector db {date},QG-M3,ai-runtime,,Basic: Shared collection with tenant filtering;Advanced: Namespace-per-tenant with hybrid search,memory-tiers;tenant-isolation,ai-lifecycle-patterns-guide.md,vector-database,solutioning
embedding-strategy,Embedding Strategy,ai-lifecycle,Use when: select and manage embedding models for tenant data,"embedding models,text embeddings,multimodal embeddings",Select and manage embedding models for tenant data,openai-embeddings;sentence-transformers;cohere;custom-fine-tuned,What embedding dimensions needed?;Tenant-specific embeddings?;Cost vs quality tradeoff?,embedding model selection {date};multi-tenant embedding patterns {date};embedding fine-tuning strategies {date},QG-M3,vector-database,,Basic: Shared embedding model;Advanced: Tenant-specific fine-tuned embeddings,model-fine-tuning-guide;memory-tiers,ai-lifecycle-patterns-guide.md,embedding-strategy,solutioning
agent-memory-optimization,Agent Memory Optimization,ai,Use for AI/agent workloads requiring optimize agent memory usage across tiers,"memory efficiency,context window,token optimization",Optimize agent memory usage across tiers,context-compression;memory-pruning;hierarchical-summary;sliding-window,What memory persistence needed?;Token budget constraints?;Cross-session continuity?,agent memory optimization {date};LLM context window management {date};memory-efficient agents {date},QG-M3,memory-tiers,,Basic: Fixed context window;Advanced: Hierarchical memory with compression,memory-tiers;llm-cost-optimization-guide;cost-tracking,ai-runtime-patterns-guide.md,agent-memory-optimization,solutioning
llm-observability,Llm Observability,operations,Use for operational concerns: implement llm-specific observability and debugging,"LLM monitoring,prompt tracing,model performance",Implement LLM-specific observability and debugging,langsmith;langfuse;helicone;phoenix;custom,What LLM metrics to track?;Prompt versioning integration?;Cost attribution granularity?,LLM observability platforms {date};prompt tracing best practices {date};LLM debugging patterns {date},QG-P1,observability,,Basic: Request logging with tokens;Advanced: Full prompt tracing with evaluation,observability;llmops;cost-tracking,operations-patterns-guide.md,llm-observability,production
tenant-sandbox,Tenant Sandbox,tenant,Use for tenant management: provision isolated development sandboxes per tenant,"development environment,testing isolation,demo instances",Provision isolated development sandboxes per tenant,ephemeral;persistent;cloned;synthetic-data,What sandbox lifecycle policy?;Data seeding approach?;Production parity level?,tenant sandbox provisioning {date};development environment multi-tenant {date};ephemeral environment patterns {date},QG-P1,tenant-isolation,,Basic: Shared dev environment with tenant prefix;Advanced: Fully isolated ephemeral sandboxes,local-development-setup;tenant-onboarding-patterns;testing-tenant-isolation,tenant-patterns-guide.md,tenant-sandbox,production
prompt-management,Prompt Management,ai-lifecycle,Use when: manage prompt lifecycle and optimization,"prompt engineering,prompt versioning,prompt templates",Manage prompt lifecycle and optimization,template-based;dynamic-generation;a-b-testing;version-control,How to version prompts?;A/B testing strategy?;Prompt template inheritance?,prompt engineering best practices {date};prompt versioning systems {date};LLM prompt management {date},QG-M3,ai-runtime,,Basic: Static prompt templates;Advanced: Dynamic prompts with A/B testing,prompt-catalog-guide;llmops;agent-runtime-patterns,ai-lifecycle-patterns-guide.md,prompt-management,solutioning
billing-integration,Billing Integration,monetization,Use for billing/metering: integrate billing and payment systems,"payment processing,subscription management,invoice generation",Integrate billing and payment systems,stripe;paddle;chargebee;custom-billing,What payment processor?;Subscription model complexity?;Multi-currency support?,SaaS billing integration {date};subscription management patterns {date};usage-based billing {date},QG-P1,usage-metering,,Basic: Simple subscription billing;Advanced: Usage-based with overage,usage-metering;cost-tracking;tenant-lifecycle,cost-patterns-guide.md,billing-integration,production
ai-runtime-config,Ai Runtime Config,ai,Use for AI/agent workloads requiring configure ai model runtime parameters,"model configuration,inference settings,runtime parameters",Configure AI model runtime parameters,temperature;max-tokens;timeout;retry-policy;model-selection,What inference parameters?;Per-tenant model selection?;Fallback configuration?,LLM configuration best practices {date};model inference optimization {date};AI runtime configuration {date},QG-M3,ai-runtime,,Basic: Global configuration;Advanced: Per-tenant model routing,agent-runtime-patterns;llmops;run-contracts,ai-runtime-patterns-guide.md,ai-runtime-config,solutioning
tenant-analytics,Tenant Analytics,operations,Use for operational concerns: implement tenant-scoped analytics and reporting,"usage analytics,business intelligence,reporting dashboards",Implement tenant-scoped analytics and reporting,embedded-analytics;export-api;custom-dashboards;real-time-metrics,What analytics dimensions?;Self-service vs managed?;Data export requirements?,multi-tenant analytics {date};embedded BI SaaS {date};tenant reporting patterns {date},QG-P1,observability,,Basic: Pre-built dashboards;Advanced: Self-service analytics,observability;cost-tracking;usage-metering,operations-patterns-guide.md,tenant-analytics,production
sso-authentication,Sso Authentication,security,"Use when implementing implement enterprise sso and identity federation with signals: enterprise SSO,SAML,OIDC,identity federation","enterprise SSO,SAML,OIDC,identity federation",Implement enterprise SSO and identity federation,saml-2-0;oidc;ldap;scim-provisioning,What IdP protocols supported?;JIT provisioning needed?;Session management strategy?,enterprise SSO SaaS {date};SAML OIDC integration {date};multi-tenant authentication {date},QG-S5,tenant-isolation,,Basic: OIDC only;Advanced: Full SAML + SCIM provisioning,sso-integration-patterns;tenant-routing,security-patterns-guide.md,sso-authentication,solutioning
api-security,Api Security,security,"Use when implementing secure tenant api access and authentication with signals: api authentication,rate limiting,api keys","api authentication,rate limiting,api keys",Secure tenant API access and authentication,api-keys;jwt;oauth2;mutual-tls,API authentication method?;Key rotation policy?;Scope-based authorization?,API security best practices {date};tenant API authentication {date};API key management SaaS {date},QG-S5,tenant-routing,,Basic: API keys with rotation;Advanced: OAuth2 with scopes,rate-limiting;quota-management;encryption-patterns,security-patterns-guide.md,api-security,solutioning
data-encryption,Data Encryption,security,"Use when implementing implement data encryption for tenant data with signals: encryption at rest,encryption in transit,key management","encryption at rest,encryption in transit,key management",Implement data encryption for tenant data,aes-256;kms;customer-managed-keys;envelope-encryption,Encryption algorithm?;Key management strategy?;Per-tenant keys?,data encryption SaaS {date};tenant key management {date};envelope encryption patterns {date},QG-P1,tenant-isolation,,Basic: Platform-managed keys;Advanced: Customer-managed keys (CMK),encryption-patterns;compliance,security-patterns-guide.md,data-encryption,production
connection-pooling,Connection Pooling,database,Use when: tenant-aware connection pooling,"high concurrency,shared resources",Tenant-aware connection pooling,pgbouncer;hikari;custom,Pool size per tenant?;Connection limits?,multi-tenant connection pooling {date};PgBouncer tenant patterns {date},QG-M2,database;performance,,Basic: Shared pool;Advanced: Per-tenant pools,tenant-routing;multi-tenant-patterns,data-patterns-guide.md,connection-pooling,solutioning
query-routing,Query Routing,database,Use when: database query routing,"read replicas,write primary",Database query routing,read-replica;primary-only;split,Read/write split needed?;Tenant-specific routing?,database query routing multi-tenant {date},QG-M2,connection-pooling,,Basic: Single primary;Advanced: Read replicas,tenant-routing;multi-tenant-patterns,data-patterns-guide.md,query-routing,solutioning
tenant-db-context,Tenant Db Context,database,Use when: tenant database context,"connection context,SET LOCAL",Tenant database context,set-local;connection-var;app-context,How to propagate tenant ID?;Context validation?,PostgreSQL SET LOCAL tenant {date},QG-M2,tenant-context-propagation,,Basic: App-level;Advanced: Connection-level,multi-tenant-context;rls-best-practices,data-patterns-guide.md,tenant-db-context,solutioning
migration-per-tenant,Migration Per Tenant,database,Use when: tenant-aware migrations,"schema DDL,zero-downtime",Tenant-aware migrations,shared;per-schema;per-database,Migration strategy?;Rollback plan?,multi-tenant database migrations {date},QG-M2,tenant-isolation,,Basic: Shared migrations;Advanced: Per-tenant DDL,tenant-migration-patterns;deployment,data-patterns-guide.md,migration-per-tenant,solutioning
rag-retrieval,Rag Retrieval,ai,Use for AI/agent workloads requiring rag retrieval patterns,"semantic search,document retrieval",RAG retrieval patterns,vector-search;hybrid;keyword,Retrieval method?;Chunk size?;Tenant isolation?,RAG retrieval patterns {date},QG-M3,vector-database,,Basic: Simple vector;Advanced: Hybrid retrieval,rag-architecture-guide;vector-database-guide,ai-runtime-patterns-guide.md,rag-retrieval,solutioning
rag-generation,Rag Generation,ai,Use for AI/agent workloads requiring rag generation patterns,"context augmentation,synthesis",RAG generation patterns,stuff;map-reduce;refine,Generation strategy?;Context window?,RAG generation patterns {date},QG-M3,rag-retrieval,,Basic: Stuff all;Advanced: Map-reduce,rag-architecture-guide;ai-runtime,ai-runtime-patterns-guide.md,rag-generation,solutioning
embedding-management,Embedding Management,ai,Use for AI/agent workloads requiring embedding lifecycle,"batch processing,updates",Embedding lifecycle,batch;incremental;real-time,Update frequency?;Staleness detection?,embedding lifecycle management {date},QG-M3,embedding-strategy,,Basic: Batch;Advanced: Real-time sync,model-fine-tuning-guide;vector-database-guide,ai-runtime-patterns-guide.md,embedding-management,solutioning
agent-fallback,Agent Fallback,ai,Use for AI/agent workloads requiring agent fallback chains,"graceful degradation,timeout",Agent fallback chains,model-fallback;provider-fallback;cache,Fallback hierarchy?;Quality thresholds?,LLM fallback patterns {date},QG-M3,circuit-breaker,,Basic: Single fallback;Advanced: Chain with quality gates,agent-resilience-patterns;circuit-breaker,ai-runtime-patterns-guide.md,agent-fallback,solutioning
context-compression,Context Compression,ai,Use for AI/agent workloads requiring context compression,"token optimization,summarization",Context compression,truncation;summarization;sliding-window,Compression strategy?;Information loss tolerance?,LLM context compression {date},QG-M3,agent-memory-optimization,,Basic: Truncation;Advanced: Semantic compression,memory-tiers;context-compiler-patterns,ai-runtime-patterns-guide.md,context-compression,solutioning
tool-result-caching,Tool Result Caching,ai,Use for AI/agent workloads requiring tool result caching,"deterministic tools,cache",Tool result caching,per-request;per-session;per-tenant,Cache TTL?;Invalidation strategy?,agent tool caching {date},QG-M3,tool-execution,,Basic: No cache;Advanced: Tenant-scoped TTL,tool-execution;caching-strategies,ai-runtime-patterns-guide.md,tool-result-caching,solutioning
zero-trust,Zero Trust,security,"Use when implementing zero trust architecture with signals: never trust,always verify","never trust,always verify",Zero trust architecture,network;identity;data,Trust boundaries?;Verification points?,zero trust architecture SaaS {date},QG-S5,api-security,,Basic: Perimeter;Advanced: Full zero-trust,all-security-patterns;network-security-patterns,security-patterns-guide.md,zero-trust,solutioning
rbac,Rbac,security,"Use when implementing role-based access control with signals: role-based,permissions","role-based,permissions",Role-based access control,flat;hierarchical;per-tenant,Role hierarchy?;Tenant admin roles?,RBAC multi-tenant patterns {date},QG-S5,sso-authentication,,Basic: Global roles;Advanced: Tenant-scoped roles,rbac-abac-patterns;sso-integration-patterns,security-patterns-guide.md,rbac,solutioning
abac,Abac,security,"Use when implementing attribute-based access with signals: attribute-based,dynamic","attribute-based,dynamic",Attribute-based access,policy-engine;inline;external,Policy complexity?;Real-time evaluation?,ABAC implementation patterns {date},QG-S5,rbac,,Basic: Simple rules;Advanced: External policy engine,rbac-abac-patterns;all-security-patterns,security-patterns-guide.md,abac,solutioning
secrets-management,Secrets Management,security,"Use when implementing secrets management with signals: vault,rotation","vault,rotation",Secrets management,vault;kms;env-vars,Rotation policy?;Per-tenant secrets?,secrets management multi-tenant {date},QG-S5,encryption-key-management,,Basic: Env vars;Advanced: Vault with rotation,encryption-key-management;encryption-patterns,security-patterns-guide.md,secrets-management,solutioning
tenant-encryption-at-rest,Tenant Encryption At Rest,security,"Use when implementing tenant data encryption with signals: field-level,transparent","field-level,transparent",Tenant data encryption,platform-keys;tenant-keys;field-level,Key management?;Per-tenant keys?,field level encryption multi-tenant {date},QG-P1,data-encryption,,Basic: Platform keys;Advanced: Customer-managed keys,encryption-patterns;compliance,security-patterns-guide.md,tenant-encryption-at-rest,production
audit-immutability,Audit Immutability,security,"Use when implementing immutable audit logs with signals: tamper-proof,chain","tamper-proof,chain",Immutable audit logs,append-only;blockchain;signed,Tamper detection?;Retention period?,immutable audit log patterns {date},QG-S5,compliance,,Basic: Append-only;Advanced: Cryptographic chain,audit-logging-patterns;compliance,security-patterns-guide.md,audit-immutability,solutioning
distributed-tracing,Distributed Tracing,observability,Use when: distributed tracing,"cross-service,correlation",Distributed tracing,opentelemetry;jaeger;zipkin,Trace propagation?;Tenant context in spans?,distributed tracing multi-tenant {date},QG-P1,tenant-context-propagation,,Basic: Request tracing;Advanced: Full distributed,observability;context-propagation-patterns,observability-patterns-guide.md,distributed-tracing,production
log-aggregation,Log Aggregation,observability,Use when: log aggregation,"centralized,filtering",Log aggregation,elk;loki;cloudwatch,Tenant log isolation?;Retention by tier?,log aggregation multi-tenant SaaS {date},QG-P1,observability,,Basic: Shared logs;Advanced: Tenant-isolated,observability;compliance,observability-patterns-guide.md,log-aggregation,production
apm-integration,Apm Integration,observability,Use when: apm integration,"performance,latency",APM integration,datadog;newrelic;dynatrace,Metrics per tenant?;Cost allocation?,APM multi-tenant patterns {date},QG-P1,observability,,Basic: Global APM;Advanced: Tenant dashboards,observability;observability-sre,observability-patterns-guide.md,apm-integration,production
metric-cardinality,Metric Cardinality,observability,Use when: metric cardinality control,"high cardinality,labels",Metric cardinality control,aggregation;sampling;label-limits,Tenant label strategy?;Cost control?,metric cardinality multi-tenant {date},QG-P1,observability,,Basic: No tenant labels;Advanced: Controlled cardinality,observability;cost-tracking,observability-patterns-guide.md,metric-cardinality,production
alert-routing,Alert Routing,observability,Use when: alert routing,"tenant-specific,escalation",Alert routing,pagerduty;opsgenie;custom,Per-tenant alerts?;Escalation paths?,multi-tenant alerting patterns {date},QG-P1,observability,,Basic: Global alerts;Advanced: Tenant-routed,observability;notification-system,observability-patterns-guide.md,alert-routing,production
event-sourcing,Event Sourcing,architecture,Use when: event sourcing,"event store,replay",Event sourcing,eventstore;kafka;custom,Event schema?;Tenant partitioning?,event sourcing multi-tenant {date},QG-M2,event-driven,,Basic: Single stream;Advanced: Tenant streams,event-sourcing-guide;event-driven-patterns,architecture-patterns-guide.md,event-sourcing,solutioning
cqrs,CQRS,architecture,Use when: cqrs pattern,read-write separation,CQRS pattern,separate-models;projections;views,Read model strategy?;Eventual consistency?,CQRS multi-tenant patterns {date},QG-M2,event-sourcing,,Basic: Shared models;Advanced: Tenant projections,cqrs-pattern-guide;event-sourcing-guide,architecture-patterns-guide.md,cqrs,solutioning
saga-orchestration,Saga Orchestration,integration,"Use when integrating modules with distributed tx, compensation","distributed tx,compensation",Saga orchestration,state-machine;orchestrator;workflow,Compensation strategy?;Timeout handling?,saga orchestration patterns {date},QG-I1,event-driven,,Basic: Simple saga;Advanced: Nested compensation,saga-guide;event-driven-patterns,integration-patterns-guide.md,saga-orchestration,integration
saga-choreography,Saga Choreography,integration,"Use when integrating modules with event coordination, loose-coupling","event coordination,loose-coupling",Saga choreography,domain-events;pub-sub;reactive,Event routing?;Ordering guarantees?,saga choreography patterns {date},QG-I1,saga-orchestration,,Basic: Simple events;Advanced: Event mesh,saga-guide;event-driven-patterns,integration-patterns-guide.md,saga-choreography,integration
dead-letter-queue,Dead Letter Queue,integration,"Use when integrating modules with failed messages, retry","failed messages,retry",Dead letter handling,dlq;retry-topic;manual,Retry policy?;Alert threshold?,dead letter queue patterns {date},QG-I1,event-driven,,Basic: Simple DLQ;Advanced: Automated retry,retry-policies;event-driven-patterns,integration-patterns-guide.md,dead-letter-queue,integration
event-schema-evolution,Event Schema Evolution,integration,"Use when integrating modules with backward compat, versioning","backward compat,versioning",Schema evolution,avro;protobuf;json-schema,Compatibility mode?;Registry?,event schema evolution {date},QG-I1,event-driven,,Basic: JSON;Advanced: Schema registry,facade-contracts;event-driven-patterns,integration-patterns-guide.md,event-schema-evolution,integration
cdn-caching,Cdn Caching,operations,Use for operational concerns: cdn caching,"static assets,edge",CDN caching,cloudfront;cloudflare;fastly,Tenant-aware purge?;Cache headers?,CDN multi-tenant patterns {date},QG-P1,caching-strategy,,Basic: Global CDN;Advanced: Tenant-aware,caching-strategies;performance-isolation,operations-patterns-guide.md,cdn-caching,production
edge-caching,Edge Caching,operations,Use for operational concerns: edge caching,"geo-distribution,latency",Edge caching,edge-functions;regional-cache;cf-workers,Regional strategy?;Invalidation?,edge caching patterns SaaS {date},QG-P1,cdn-caching,,Basic: Regional CDN;Advanced: Edge compute,caching-strategies;data-residency,operations-patterns-guide.md,edge-caching,production
tenant-cache-isolation,Tenant Cache Isolation,operations,Use for operational concerns: tenant cache isolation,"namespace,quotas",Tenant cache isolation,key-prefix;separate-instance;quota,Isolation strategy?;Quota enforcement?,tenant cache isolation Redis {date},QG-M2,caching-strategy,,Basic: Key prefix;Advanced: Separate instances,caching-strategies;tenant-isolation,operations-patterns-guide.md,tenant-cache-isolation,solutioning
cache-warming,Cache Warming,operations,Use for operational concerns: cache warming,"precompute,startup",Cache warming,startup;scheduled;predictive,Warming strategy?;Priority data?,cache warming strategies {date},QG-P1,caching-strategy,,Basic: On-demand;Advanced: Predictive,caching-strategies;background-jobs,operations-patterns-guide.md,cache-warming,production
cache-aside,Cache Aside,architecture,Use when: cache-aside pattern,"lazy-load,write-through",Cache-aside pattern,read-through;write-through;write-behind,Consistency model?;TTL strategy?,cache aside pattern distributed {date},QG-M2,caching-strategy,,Basic: Simple TTL;Advanced: Write-through,caching-strategies;performance-isolation,architecture-patterns-guide.md,cache-aside,solutioning
api-gateway,API Gateway,integration,"Use when integrating modules with traffic management, routing","traffic management,routing",API gateway design,kong;aws-apigw;custom,Rate limiting?;Tenant routing?,API gateway multi-tenant {date},QG-P1,rate-limiting,,Basic: Simple routing;Advanced: Full gateway,api-gateway-patterns;rate-limiting,integration-patterns-guide.md,api-gateway,production
feature-flags,Feature Flags,operations,Use for operational concerns: feature flag management,"rollout,experimentation",Feature flag management,launchdarkly;unleash;custom,Per-tenant flags?;Rollout strategy?,feature flags multi-tenant SaaS {date},QG-P1,experimentation,,Basic: Global flags;Advanced: Tenant-targeted,experimentation;customization,operations-patterns-guide.md,feature-flags,production
health-scoring,Health Scoring,analytics,Use when: tenant health scoring,"tenant health,signals",Tenant health scoring,engagement;usage;risk,Health dimensions?;Scoring model?,tenant health scoring SaaS {date},QG-P1,tenant-analytics,,Basic: Simple metrics;Advanced: ML-based scoring,observability;customer-success-guide,analytics-patterns-guide.md,health-scoring,production
analytics,Analytics,operations,Use for operational concerns: tenant analytics and reporting,"tenant analytics,reporting,business intelligence,dashboards",Tenant analytics and reporting,embedded-analytics;custom-dashboards;export-api;real-time-metrics,What analytics dimensions?;Self-service or managed?;Data export requirements?;Real-time needed?,tenant analytics patterns {date};embedded analytics multi-tenant SaaS {date};tenant reporting dashboards {date},QG-P1,observability,,Basic: Pre-built tenant dashboards;Advanced: Self-service analytics with custom dimensions,customer-success-guide;observability;cost-tracking,operations-patterns-guide.md,analytics,production
ai-operations,Ai Operations,ai,Use for AI/agent workloads requiring ai operations and management,"LLM operations,model management,AI infrastructure",AI operations and management,model-registry;deployment-pipelines;monitoring;cost-tracking,What AI models in use?;How to track model performance?;Cost attribution strategy?;Model versioning approach?,AI operations best practices {date};LLMOps platform patterns {date};AI model management multi-tenant {date},QG-M3,ai-runtime,,Basic: Single model deployment;Advanced: Full MLOps with model registry,llmops;llm-versioning;cost-tracking,ai-runtime-patterns-guide.md,ai-operations,solutioning
