pattern_id,name,category,decision_criteria,signals,intent,variants,decision_questions,web_queries,verification_gate,dependencies,conflicts,skill_level_notes,related_fragments,consolidated_guide,section_anchor,phase
ai-safety,Ai Safety,ai,Use for AI/agent workloads requiring ai safety guardrails and testing,"AI guardrails,safety testing,content moderation,harmful outputs",AI safety guardrails and testing,output-filtering;prompt-injection-detection;content-moderation;red-teaming,What safety controls needed?;Adversarial testing required?;Content moderation level?;Compliance for AI outputs?,AI safety guardrails patterns {date};LLM red teaming best practices {date};AI content moderation multi-tenant {date},QG-I3,ai-runtime,,Basic: Output filtering;Advanced: Full red-teaming with adversarial testing,testing-agent-safety;run-contracts;ai-runtime,ai-runtime-patterns-guide.md,ai-safety,integration
ai-testing,Ai Testing,ai,Use for AI/agent workloads requiring ai agent testing patterns,"agent testing,LLM testing,AI quality assurance",AI agent testing patterns,unit-testing;integration-testing;regression-testing;chaos-testing,What agent behaviors to test?;Deterministic vs stochastic tests?;Regression strategy?;Cross-tenant testing?,AI agent testing patterns {date};LLM testing frameworks {date};agent quality assurance {date},QG-I3,ai-runtime,,Basic: Deterministic output tests;Advanced: Stochastic testing with statistical validation,testing-agent-safety;ai-runtime;run-contracts,ai-runtime-patterns-guide.md,ai-testing,integration
documentation,Documentation,operations,Use for operational concerns: documentation automation,"docs automation,API documentation,tenant docs",Documentation automation,api-docs;sdk-generation;changelog;tenant-specific-docs,What documentation types needed?;Automated generation?;Tenant-specific customization?;Version documentation?,documentation automation patterns {date};API documentation generation SaaS {date};tenant documentation patterns {date},QG-P1,,,Basic: Auto-generated API docs;Advanced: Tenant-specific documentation portals,facade-contracts;api-gateway-patterns,operations-patterns-guide.md,documentation,production
resilience,Resilience,architecture,Use when: system resilience patterns,"fault tolerance,circuit breakers,graceful degradation",System resilience patterns,circuit-breaker;bulkhead;retry-policies;fallback-chains,What failure modes to handle?;Recovery strategy?;Blast radius isolation?;Degradation levels?,system resilience patterns {date};fault tolerance multi-tenant SaaS {date};graceful degradation architecture {date},QG-M1,circuit-breaker,,Basic: Circuit breakers with retries;Advanced: Full bulkhead isolation with graceful degradation,circuit-breaker;retry-policies;agent-resilience-patterns,architecture-patterns-guide.md,resilience,solutioning
ai-context,Ai Context,ai,Use for AI/agent workloads requiring ai context management,"context management,context window,token optimization",AI context management,context-compression;sliding-window;hierarchical-context;context-caching,What context window size?;Compression strategy?;Cross-session context?;Tenant context isolation?,AI context management patterns {date};LLM context window optimization {date};agent context strategies {date},QG-M3,memory-tiers,,Basic: Fixed context window;Advanced: Hierarchical context with compression,memory-tiers;context-compiler-patterns;memory-tiers,ai-runtime-patterns-guide.md,ai-context,solutioning
cost,Cost,operations,Use for operational concerns: cost management patterns,"cost management,billing optimization,resource allocation",Cost management patterns,cost-attribution;budget-enforcement;resource-quotas;cost-alerts,What cost dimensions to track?;Budget enforcement strategy?;Per-tenant cost allocation?;Optimization targets?,cost management multi-tenant SaaS {date};cloud cost optimization patterns {date};tenant cost attribution {date},QG-P1,cost-tracking,,Basic: Per-tenant cost tracking;Advanced: Full cost attribution with optimization recommendations,cost-tracking;usage-metering;llm-cost-optimization-guide,operations-patterns-guide.md,cost,production
graphql,Graphql,integration,"Use when integrating modules with GraphQL, multi-tenant API, federated schema","GraphQL,multi-tenant API,federated schema",GraphQL multi-tenant patterns,tenant-scoped-schema;federated-graphql;dataloader-per-tenant;subscription-isolation,GraphQL or REST?;Tenant schema customization?;Federation needed?;Real-time subscriptions?,GraphQL multi-tenant patterns {date};GraphQL federation SaaS {date};tenant-aware GraphQL {date},QG-I1,facade-contracts,,Basic: Tenant-scoped queries with context;Advanced: Federated GraphQL with per-tenant schemas,facade-contracts;api-gateway-patterns;tenant-routing,integration-patterns-guide.md,graphql,integration
capacity,Capacity,operations,Use for operational concerns: capacity planning and management,"resource planning,scaling thresholds,capacity management",Capacity planning and management,headroom-based;demand-forecasting;auto-scaling-triggers;tenant-quotas,What capacity dimensions to track?;Per-tenant limits?;Scaling triggers?;Forecast horizon?,capacity planning multi-tenant SaaS {date};resource capacity management patterns {date};tenant capacity allocation {date},QG-CP1,performance-isolation,,Basic: Static capacity limits;Advanced: Dynamic capacity with demand forecasting,performance-isolation;scaling-patterns;cost-tracking,operations-patterns-guide.md,capacity,solutioning
auto-scaling,Auto Scaling,operations,Use for operational concerns: auto-scaling patterns for multi-tenant,"elastic scaling,demand response,resource automation",Auto-scaling patterns for multi-tenant,horizontal;vertical;predictive;tenant-aware,Scaling dimensions?;Per-tenant scaling policies?;Scale-down delay?;Minimum baseline?,auto-scaling multi-tenant SaaS {date};Kubernetes HPA tenant patterns {date};predictive scaling patterns {date},QG-P1,capacity,,Basic: CPU-based HPA;Advanced: Custom metrics with tenant-aware scaling,capacity-planning-guide;performance-isolation;cost-tracking,operations-patterns-guide.md,auto-scaling,production
infrastructure,Infrastructure,operations,Use for operational concerns: infrastructure management patterns,"cloud resources,IaC,platform management",Infrastructure management patterns,terraform;pulumi;crossplane;tenant-provisioning,IaC tool choice?;Per-tenant infrastructure?;Environment parity?;Drift detection?,infrastructure as code multi-tenant {date};tenant infrastructure provisioning patterns {date};cloud infrastructure SaaS {date},QG-P1,deployment,,Basic: Shared infrastructure;Advanced: Per-tenant infrastructure with IaC,deployment;tenant-lifecycle;disaster-recovery,operations-patterns-guide.md,infrastructure,production
governance,Governance,operations,Use for operational concerns: platform governance patterns,"policy enforcement,standards compliance,decision frameworks",Platform governance patterns,policy-as-code;approval-workflows;audit-trails;change-advisory,What governance policies needed?;Approval requirements?;Audit depth?;Change management?,platform governance patterns {date};SaaS governance frameworks {date};policy-as-code multi-tenant {date},QG-P1,compliance,,Basic: Manual governance;Advanced: Policy-as-code with automated enforcement,compliance;audit-logging-patterns;rbac-abac-patterns,operations-patterns-guide.md,governance,production
tenant-support,Tenant Support,operations,Use for operational concerns: tenant support management,"support tickets,issue tracking,customer service",Tenant support management,ticketing-integration;escalation-rules;sla-tracking;self-service,Support channels needed?;SLA tiers?;Escalation paths?;Self-service scope?,tenant support patterns SaaS {date};customer support multi-tenant {date};support ticketing integration {date},QG-P1,tenant-lifecycle,,Basic: Shared support queue;Advanced: Tier-based support with SLA tracking,tenant-lifecycle;sla-management-guide;notification-system,operations-patterns-guide.md,tenant-support,production
tenant-communication,Tenant Communication,operations,Use for operational concerns: tenant communication patterns,"notifications,announcements,messaging",Tenant communication patterns,in-app-messaging;email-campaigns;status-pages;release-notes,Communication channels?;Segmentation needs?;Automation level?;Opt-out handling?,tenant communication patterns SaaS {date};customer communication multi-tenant {date};SaaS notification strategies {date},QG-P1,notification-system,,Basic: Email notifications;Advanced: Multi-channel with segmentation,notification-system;tenant-lifecycle;support-engineer-guide,operations-patterns-guide.md,tenant-communication,production
security,Security,security,"Use when implementing security architecture patterns with signals: access control,threat protection,data security","access control,threat protection,data security",Security architecture patterns,defense-in-depth;least-privilege;zero-trust;threat-modeling,Security posture?;Threat model scope?;Compliance requirements?;Incident response?,security architecture patterns SaaS {date};multi-tenant security best practices {date};cloud security patterns {date},QG-S5,tenant-isolation,,Basic: Perimeter security;Advanced: Zero-trust with defense-in-depth,all-security-patterns;rbac-abac-patterns;rbac-abac-patterns;encryption-key-management,security-patterns-guide.md,security,solutioning
monitoring,Monitoring,operations,Use for operational concerns: monitoring and alerting patterns,"metrics collection,alerting,dashboards",Monitoring and alerting patterns,prometheus;datadog;cloudwatch;tenant-scoped,What metrics to collect?;Per-tenant dashboards?;Alert routing?;Retention policy?,monitoring multi-tenant SaaS {date};tenant-aware monitoring patterns {date};SaaS observability stack {date},QG-P1,observability,,Basic: Shared monitoring;Advanced: Tenant-scoped dashboards with custom alerts,observability;notification-system;analytics-guide,operations-patterns-guide.md,monitoring,production
incident-response,Incident Response,operations,Use for operational concerns: incident response patterns,"incident management,runbooks,post-mortems",Incident response patterns,runbook-automation;escalation-chains;blameless-postmortems;status-communication,Incident severity levels?;On-call rotation?;Communication protocol?;Post-mortem process?,incident response patterns SaaS {date};multi-tenant incident management {date};SRE incident practices {date},QG-IR1,monitoring,,Basic: Manual runbooks;Advanced: Automated response with tenant impact isolation,observability;notification-system;disaster-recovery;runbook-guide,operations-patterns-guide.md,incident-response,solutioning
sla-monitoring,Sla Monitoring,operations,Use for operational concerns: sla monitoring and enforcement,"SLA tracking,performance targets,breach detection",SLA monitoring and enforcement,uptime-tracking;latency-monitoring;breach-alerts;credit-automation,What SLAs to track?;Breach notification?;Credit automation?;Reporting frequency?,SLA monitoring patterns SaaS {date};multi-tenant SLA tracking {date};SLA breach detection {date},QG-SLA1,monitoring,,Basic: Uptime tracking;Advanced: Full SLA dashboard with automated credits,observability;support-engineer-guide;billing-integration-patterns,operations-patterns-guide.md,sla-monitoring,solutioning
audit-logging,Audit Logging,security,"Use when implementing audit logging patterns with signals: audit trails,compliance logging,forensics","audit trails,compliance logging,forensics",Audit logging patterns,structured-logging;immutable-storage;tenant-scoped;compliance-retention,What events to audit?;Retention requirements?;Search capabilities?;Compliance mapping?,audit logging patterns SaaS {date};multi-tenant audit trails {date};compliance logging {date},QG-S5,compliance,,Basic: Application logging;Advanced: Immutable audit trails with compliance mapping,compliance;audit-logging-patterns;observability,security-patterns-guide.md,audit-logging,solutioning
data-export,Data Export,tenant,Use for tenant management: tenant data export patterns,"data portability,GDPR export,tenant data access",Tenant data export patterns,bulk-export;streaming-export;format-options;access-controls,Export formats needed?;Size limits?;Scheduling options?;Access controls?,tenant data export patterns {date};GDPR data portability SaaS {date};data export multi-tenant {date},QG-P1,compliance,,Basic: Manual CSV export;Advanced: Automated exports with multiple formats,compliance;data-residency;tenant-lifecycle,tenant-patterns-guide.md,data-export,production
operations,Operations,operations,Use for operational concerns: operational patterns overview,"operational patterns,platform management,runtime concerns",Operational patterns overview,monitoring;alerting;scaling;capacity,What operational concerns?;Automation level?;On-call strategy?;Cost optimization?,SaaS operations patterns {date};platform operations best practices {date};multi-tenant operations {date},QG-P1,,,Basic: Manual operations;Advanced: Full automation with self-healing,observability;observability;disaster-recovery,operations-patterns-guide.md,operations,production
ai-runtime,Ai Runtime,ai,Use for AI/agent workloads requiring ai model runtime patterns,"AI model runtime,inference,model serving",AI model runtime patterns,synchronous;asynchronous;batch;streaming,Inference latency requirements?;Batch vs real-time?;Model caching strategy?;Tenant isolation?,AI model runtime patterns {date};LLM inference optimization {date};model serving multi-tenant {date},QG-M3,ai-runtime,,Basic: Single model endpoint;Advanced: Multi-model routing with tenant isolation,ai-runtime;llmops;llmops,ai-runtime-patterns-guide.md,ai-runtime,solutioning
data-integrity,Data Integrity,data,Use when: data integrity patterns,"data validation,consistency,correctness",Data integrity patterns,validation;checksums;reconciliation;integrity-checks,What validation rules?;Consistency requirements?;Reconciliation frequency?;Error handling?,data integrity patterns SaaS {date};data validation multi-tenant {date};data consistency patterns {date},QG-M2,tenant-isolation,,Basic: Application-level validation;Advanced: Database constraints with reconciliation,compliance;tenant-isolation;observability,data-patterns-guide.md,data-integrity,solutioning
reporting,Reporting,analytics,Use when: reporting and analytics export,"business reports,analytics exports,scheduled reports",Reporting and analytics export,scheduled-reports;ad-hoc;dashboards;data-exports,Report types needed?;Scheduling frequency?;Export formats?;Tenant customization?,reporting patterns SaaS {date};multi-tenant reporting {date};business intelligence export {date},QG-P1,analytics,,Basic: Pre-built reports;Advanced: Custom report builder with scheduling,analytics-guide;analytics-guide;data-archival,analytics-patterns-guide.md,reporting,production
payment-processing,Payment Processing,monetization,Use for billing/metering: payment processing patterns,"payment gateway,transactions,billing",Payment processing patterns,stripe;paddle;paypal;multi-gateway,Payment methods?;Multi-currency?;PCI compliance?;Retry logic?,payment processing SaaS {date};multi-tenant payment patterns {date};payment gateway integration {date},QG-P1,billing-integration,,Basic: Single payment gateway;Advanced: Multi-gateway with failover,billing-integration-patterns;usage-metering;compliance,cost-patterns-guide.md,payment-processing,production
partner-ecosystem,Partner Ecosystem,integration,"Use when integrating modules with partner integrations, marketplace, ecosystem","partner integrations,marketplace,ecosystem",Partner ecosystem patterns,partner-api;marketplace;white-label;revenue-share,Partner types?;Integration depth?;Revenue model?;Certification process?,partner ecosystem SaaS {date};marketplace architecture {date};partner integration patterns {date},QG-P1,tenant-lifecycle,,Basic: Partner API access;Advanced: Full marketplace with revenue sharing,tenant-lifecycle;billing-integration-patterns;customization,integration-patterns-guide.md,partner-ecosystem,production
devops,Devops,operations,Use for operational concerns: devops and deployment automation,"CI/CD,automation,deployment",DevOps and deployment automation,github-actions;gitlab-ci;jenkins;argocd,CI/CD tooling?;Deployment strategy?;Environment management?;Rollback automation?,DevOps patterns SaaS {date};multi-tenant CI/CD {date};deployment automation patterns {date},QG-P1,deployment,,Basic: Simple CI/CD pipeline;Advanced: GitOps with tenant-aware deployments,deployment;devops-guide;observability,operations-patterns-guide.md,devops,production
sre,Sre,operations,Use for operational concerns: sre practices and patterns,"site reliability,incident management,toil reduction",SRE practices and patterns,sli-slo;error-budgets;toil-automation;chaos-engineering,SLO targets?;Error budget policy?;Toil reduction strategy?;Chaos testing?,SRE patterns SaaS {date};site reliability multi-tenant {date};SLO management patterns {date},QG-P1,monitoring,,Basic: Basic SLOs;Advanced: Full SRE practice with chaos engineering,observability;incident-response-patterns;observability,operations-patterns-guide.md,sre,production
sla,Sla,operations,Use for operational concerns: sla definition and management,"service agreements,SLA management,guarantees",SLA definition and management,availability;latency;support;compliance,Availability targets?;Latency guarantees?;Support SLAs?;Penalty structure?,SLA patterns SaaS {date};multi-tenant SLA management {date};service level agreements {date},QG-P1,sla-monitoring,,Basic: Standard SLAs;Advanced: Tiered SLAs with custom negotiations,sla-management-guide;support-engineer-guide;billing-integration-patterns,operations-patterns-guide.md,sla,production
performance,Performance,operations,Use for operational concerns: performance optimization patterns,"performance optimization,latency,throughput",Performance optimization patterns,caching;query-optimization;async-processing;connection-pooling,Performance targets?;Bottleneck analysis?;Optimization priorities?;Load testing?,performance optimization SaaS {date};multi-tenant performance patterns {date};latency optimization {date},QG-P1,performance-isolation,,Basic: Basic caching;Advanced: Full performance suite with continuous optimization,performance-isolation;caching-strategies;observability,operations-patterns-guide.md,performance,production
api-design,API Design,integration,"Use when integrating modules with API design, REST, versioning","API design,REST,versioning",API design patterns,rest;graphql;grpc;openapi,API style?;Versioning strategy?;Documentation approach?;SDK generation?,API design patterns {date};multi-tenant API design {date};REST API best practices {date},QG-I1,facade-contracts,,Basic: REST with versioning;Advanced: Multi-protocol with SDK generation,facade-contracts;graphql-multi-tenancy;api-documentation,integration-patterns-guide.md,api-design,integration
ai-streaming-design,Ai Streaming Design,ai,Use for AI/agent workloads requiring ai streaming response patterns,"streaming inference,real-time AI,SSE",AI streaming response patterns,server-sent-events;websocket;chunked-response;long-polling,Streaming protocol?;Backpressure handling?;Connection management?;Tenant isolation?,AI streaming patterns {date};LLM streaming responses {date};real-time AI multi-tenant {date},QG-M3,ai-runtime,,Basic: SSE streaming;Advanced: Multi-tenant streaming with backpressure,ai-runtime;ai-runtime;performance-isolation,ai-runtime-patterns-guide.md,ai-streaming-design,solutioning
ai-feedback-loop,Ai Feedback Loop,ai,Use for AI/agent workloads requiring ai feedback and improvement,"feedback collection,RLHF,continuous improvement",AI feedback and improvement,thumbs-up-down;detailed-feedback;implicit-signals;rlhf,Feedback types?;Collection mechanism?;Tenant attribution?;Model improvement cycle?,AI feedback loop patterns {date};RLHF multi-tenant {date};LLM feedback collection {date},QG-M3,ai-operations,,Basic: Simple ratings;Advanced: Full feedback loop with model retraining,llmops;llmops;analytics-guide,ai-runtime-patterns-guide.md,ai-feedback-loop,solutioning
ai-batch,Ai Batch,ai,Use for AI/agent workloads requiring batch ai processing patterns,"batch processing,bulk inference,scheduled AI",Batch AI processing patterns,queue-based;scheduled;event-triggered;priority-based,Batch size limits?;Priority handling?;Failure recovery?;Cost optimization?,batch AI processing patterns {date};LLM batch inference {date};bulk AI operations {date},QG-M3,background-jobs,,Basic: Simple queue processing;Advanced: Priority queues with cost optimization,background-jobs;llmops;cost-tracking,ai-runtime-patterns-guide.md,ai-batch,solutioning
evaluation-patterns,Evaluation Patterns,ai,Use for AI/agent workloads requiring ai evaluation and benchmarking,"model evaluation,metrics,benchmarks",AI evaluation and benchmarking,accuracy;latency;cost;user-satisfaction,Evaluation metrics?;Benchmark strategy?;A/B testing approach?;Regression detection?,AI evaluation patterns {date};LLM benchmarking {date};model evaluation multi-tenant {date},QG-M3,ai-testing,,Basic: Accuracy metrics;Advanced: Full evaluation suite with A/B testing,testing-agent-safety;llmops;observability,ai-runtime-patterns-guide.md,evaluation-patterns,solutioning
dashboard,Dashboard,analytics,Use when: dashboard and visualization patterns,"dashboards,visualization,metrics display",Dashboard and visualization patterns,embedded;custom;tenant-branded;real-time,Dashboard types?;Real-time requirements?;Tenant customization?;Export capabilities?,dashboard patterns SaaS {date};multi-tenant dashboards {date};embedded analytics {date},QG-P1,analytics,,Basic: Pre-built dashboards;Advanced: Custom dashboard builder with tenant branding,analytics-guide;analytics-guide;observability,analytics-patterns-guide.md,dashboard,production
agent-orchestration,Agent Orchestration,ai,Use for AI/agent workloads requiring agent orchestration patterns,"multi-agent,coordination,workflow",Agent orchestration patterns,sequential;parallel;hierarchical;dynamic,Orchestration complexity?;State management?;Error handling?;Human-in-the-loop?,agent orchestration patterns {date};multi-agent coordination {date};AI agent workflows {date},QG-M3,ai-runtime,,Basic: Sequential execution;Advanced: Dynamic orchestration with state machines,ai-runtime;agent-coordination;run-contracts,ai-runtime-patterns-guide.md,agent-orchestration,solutioning
discovery-patterns,Discovery Patterns,discovery,Use when: discovery phase patterns,"requirements,stakeholders,scope",Discovery phase patterns,stakeholder-interviews;requirement-gathering;scope-definition,What requirements exist?;Who are stakeholders?;What is in/out of scope?,SaaS discovery phase best practices {date};multi-tenant requirements gathering {date},QG-D1,,,Basic: Stakeholder interviews;Advanced: Full discovery workshop,analyst-guide,discovery-patterns-guide.md,discovery-patterns,discovery
requirements-patterns,Requirements Patterns,discovery,Use when: requirements gathering patterns,"requirements,PRD,user stories",Requirements gathering patterns,functional;non-functional;constraints;assumptions,What functional requirements?;What NFRs?;What constraints?,requirements gathering SaaS {date};multi-tenant requirements patterns {date},QG-D1,discovery-patterns,,Basic: Feature list;Advanced: Full PRD with acceptance criteria,analyst-guide,discovery-patterns-guide.md,requirements-patterns,discovery
planning-patterns,Planning Patterns,planning,Use when: planning phase patterns,"roadmap,milestones,timeline",Planning phase patterns,milestone-planning;resource-allocation;risk-assessment,What milestones?;What resources?;What risks?,SaaS project planning best practices {date};roadmap patterns {date},QG-PL1,discovery-patterns,,Basic: Milestone list;Advanced: Full roadmap with dependencies,module-architecture,discovery-patterns-guide.md,planning-patterns,planning
agile-patterns,Agile Patterns,planning,Use when: agile planning patterns,"sprints,stories,estimation",Agile planning patterns,story-points;sprint-planning;backlog-grooming,How to estimate?;Sprint length?;Backlog strategy?,agile planning SaaS {date};story estimation patterns {date},QG-PL1,planning-patterns,,Basic: Story points;Advanced: Full velocity tracking,module-architecture,discovery-patterns-guide.md,agile-patterns,planning
tool-schema-valid,Tool Schema Valid,gate-verification,Use when: tool schema validation,"tool schema,validation,contracts",Tool schema validation,json-schema;openapi;pydantic,Schema format?;Validation depth?;Error handling?,tool schema validation patterns {date};AI tool contracts {date},QG-M3-T,tool-execution,,Basic: JSON schema;Advanced: Runtime validation,tool-execution-middleware,gate-verification-patterns-guide.md,tool-schema-valid,solutioning
permissions-defined,Permissions Defined,gate-verification,Use when: tool permission patterns,"permissions,RBAC,tool access",Tool permission patterns,role-based;tenant-scoped;approval-required,What roles can use tools?;Tenant restrictions?;Approval workflow?,tool permission patterns {date};AI tool RBAC {date},QG-M3-T,tool-execution,,Basic: Role-based;Advanced: Dynamic permissions,agent-identity-tbac-patterns,gate-verification-patterns-guide.md,permissions-defined,solutioning
sandbox-configured,Sandbox Configured,gate-verification,Use when: tool sandboxing patterns,"sandboxing,isolation,security",Tool sandboxing patterns,process-isolation;network-isolation;resource-limits,What isolation needed?;Resource limits?;Network access?,tool sandboxing patterns {date};AI tool security isolation {date},QG-M3-T,tool-execution,,Basic: Process isolation;Advanced: Full sandboxing,tool-execution-middleware,gate-verification-patterns-guide.md,sandbox-configured,solutioning
