pattern_id,name,category,decision_criteria,signals,intent,variants,decision_questions,web_queries,verification_gate,dependencies,conflicts,skill_level_notes,related_fragments,consolidated_guide,section_anchor,phase
tenant-isolation,Tenant Isolation,security,"Use when implementing prevent cross-tenant data access with signals: shared data,multi-tenant,customer separation","shared data,multi-tenant,customer separation",Prevent cross-tenant data access,row-level-security;schema-per-tenant;database-per-tenant,What compliance requirements apply?;How many tenants expected?;What isolation level required?,multi-tenant isolation patterns {date};PostgreSQL RLS best practices {date},QG-M2,database;security,,Basic: RLS with tenant_id column;Advanced: Schema isolation with connection pooling,rls-best-practices;multi-tenant-patterns;testing-tenant-isolation,security-patterns-guide.md,tenant-isolation,solutioning
agent-runtime,Agent Runtime,ai,Use for AI/agent workloads requiring design agent execution framework,"LLM agents,orchestration,multi-step",Design agent execution framework,langgraph;crewai;autogen;custom,What orchestration complexity needed?;Human-in-the-loop required?;State persistence needs?,LangGraph agent patterns {date};agent orchestration best practices {date},QG-M3,tenant-isolation,,Basic: Single agent with tools;Advanced: Hierarchical multi-agent,agent-runtime-patterns;run-contracts;memory-tiers,ai-runtime-patterns-guide.md,agent-runtime,solutioning
module-boundaries,Module Boundaries,architecture,Use when: define module separation,"modular monolith,bounded context,DDD",Define module separation,vertical-slice;feature-module;domain-module,What bounded contexts exist?;What are module dependencies?;Cross-module communication patterns?,modular monolith patterns {date};bounded context design {date},QG-M1,api-design;domain-modeling,,Basic: Feature folders;Advanced: Event-driven boundaries,modular-monolith-patterns;ddd-module-patterns;module-facade-patterns,architecture-patterns-guide.md,module-boundaries,solutioning
memory-tiers,Memory Tiers,ai,Use for AI/agent workloads requiring hierarchical memory for agents,"agent memory,context,persistence",Hierarchical memory for agents,working;episodic;semantic;procedural;collective,What memory persistence needed?;Cross-session requirements?;Tenant isolation for memory?,AI agent memory architecture {date};LangGraph memory patterns {date},QG-M3,ai-runtime,,Basic: Working memory only;Advanced: Full 5-tier hierarchy,memory-tiers;context-compiler-patterns,ai-runtime-patterns-guide.md,memory-tiers,solutioning
tool-execution,Tool Execution,ai,Use for AI/agent workloads requiring govern agent tool usage,"agent tools,function calling,MCP",Govern agent tool usage,direct;sandboxed;approval-required;tenant-scoped,What tools does agent need?;Approval workflow required?;Tenant-specific tools?,agent tool execution patterns {date};MCP tool patterns {date},QG-M3,ai-runtime,,Basic: Direct execution;Advanced: TBAC with approval workflows,tool-execution-middleware;action-gateway-patterns;agent-identity-tbac-patterns,ai-runtime-patterns-guide.md,tool-execution,solutioning
run-contracts,Run Contracts,ai,Use for AI/agent workloads requiring control agent execution scope,"agent scope,budget,guardrails",Control agent execution scope,time-limited;token-limited;cost-limited;action-limited,What execution limits needed?;Budget enforcement required?;Fallback behavior?,AI agent run contracts {date};agent budget enforcement {date},QG-M3,ai-runtime,,Basic: Token limits;Advanced: Full budget with circuit breakers,run-contracts;agent-resilience-patterns,ai-runtime-patterns-guide.md,run-contracts,solutioning
event-driven,Event-Driven Architecture,integration,"Use when integrating modules with async, messaging, decoupling","async,messaging,decoupling",Cross-module communication,domain-events;integration-events;saga-orchestration,What events cross module boundaries?;Eventual consistency acceptable?;Saga patterns needed?,event-driven architecture patterns {date};saga orchestration {date},QG-I1,module-boundaries,,Basic: Domain events;Advanced: Saga with compensation,event-driven-patterns;saga-orchestration-patterns,integration-patterns-guide.md,event-driven,integration
facade-contracts,Facade Contracts,integration,"Use when integrating modules with API, module interface, versioning","API,module interface,versioning",Module public interfaces,REST;GraphQL;gRPC;async,What interface stability needed?;Breaking change strategy?;Multi-version support?,API versioning patterns {date};facade design patterns {date},QG-I1,module-boundaries,,Basic: REST with versioning;Advanced: Multi-protocol facade,module-facade-patterns;api-version-routing,integration-patterns-guide.md,facade-contracts,integration
tenant-lifecycle,Tenant Lifecycle,tenant,Use for tenant management: manage tenant state changes,"onboarding,offboarding,provisioning",Manage tenant state changes,self-service;assisted;enterprise,What provisioning automation needed?;Data retention requirements?;Offboarding compliance?,tenant lifecycle management {date};SaaS onboarding patterns {date},QG-P1,tenant-isolation,,Basic: Manual provisioning;Advanced: Full self-service,tenant-onboarding-patterns;tenant-offboarding-patterns,tenant-patterns-guide.md,tenant-lifecycle,production
observability,Observability Stack,operations,Use for operational concerns: tenant-aware telemetry,"monitoring,tracing,logging",Tenant-aware telemetry,metrics;traces;logs;alerts,What SLOs needed?;Tenant-scoped dashboards?;Cost attribution?,tenant-aware observability {date};multi-tenant monitoring {date},QG-P1,tenant-isolation,,Basic: Shared dashboards;Advanced: Per-tenant telemetry,observability;audit-logging-patterns,operations-patterns-guide.md,observability,production
usage-metering,Usage Metering,monetization,Use for billing/metering: track resource usage,"billing,quotas,limits",Track resource usage,request-based;storage-based;compute-based;feature-based,What usage dimensions to track?;Real-time or batch metering?;Overage handling?,usage-based billing patterns {date};SaaS metering {date},QG-P1,tenant-isolation,,Basic: API request counting;Advanced: Multi-dimensional metering,usage-metering;billing-integration-patterns,cost-patterns-guide.md,usage-metering,production
compliance,Compliance Framework,security,"Use when implementing meet regulatory requirements with signals: GDPR,SOC2,HIPAA,regulations","GDPR,SOC2,HIPAA,regulations",Meet regulatory requirements,data-residency;audit-logging;encryption;retention,What regulations apply?;Data residency requirements?;Audit trail depth?,SaaS compliance patterns {date};data sovereignty {date},QG-P1,tenant-isolation,,Basic: Audit logging;Advanced: Full compliance framework,sso-integration-patterns;data-sovereignty-patterns;encryption-patterns,security-patterns-guide.md,compliance,production
deployment,Deployment Strategy,operations,Use for operational concerns: safe production deployments,"CI/CD,releases,rollback",Safe production deployments,blue-green;canary;feature-flags;ring,What rollback speed needed?;Tenant-scoped deployments?;Feature flag strategy?,SaaS deployment strategies {date};feature flag patterns {date},QG-P1,infrastructure;containerization,,Basic: Blue-green;Advanced: Per-tenant canary,deployment;feature-toggle-patterns,operations-patterns-guide.md,deployment,production
testing-isolation,Testing Isolation,testing,Use when testing: verify tenant separation,"tenant separation,security testing",Verify tenant separation,unit;integration;chaos;penetration,What isolation tests needed?;Cross-tenant attack simulation?;Automated vs manual?,multi-tenant testing patterns {date};tenant isolation testing {date},QG-M2,tenant-isolation;test-data-management,,Basic: Unit tests with tenant context;Advanced: Chaos engineering,testing-tenant-isolation,testing-patterns-guide.md,testing-isolation,solutioning
testing-agent-safety,Agent Safety Testing,testing,Use when testing: verify agent controls,"AI safety,guardrails,limits",Verify agent controls,deterministic;stochastic;adversarial;regression,What safety properties to verify?;Adversarial testing needed?;Regression strategy?,AI agent safety testing {date};LLM testing patterns {date},QG-I3,ai-runtime,,Basic: Output validation;Advanced: Adversarial red teaming,testing-agent-safety,testing-patterns-guide.md,testing-agent-safety,integration
customization,Tenant Customization,tenant,Use for tenant management: per-tenant experience,"white-label,theming,branding",Per-tenant experience,theming;feature-flags;configuration;extensions,What customization dimensions?;Tenant vs tier-based?;Extension points?,SaaS customization patterns {date};white-label architecture {date},QG-M1,tenant-isolation,,Basic: Theme variables;Advanced: Full white-label,tenant-customization-patterns;white-labeling-guide,tenant-patterns-guide.md,customization,solutioning
experimentation,Experimentation Platform,tenant,Use for tenant management: data-driven decisions,"A/B testing,feature flags,analytics",Data-driven decisions,feature-flags;cohort-analysis;metrics,What experiments to run?;Statistical significance?;Tenant-scoped experiments?,SaaS experimentation platform {date};A/B testing patterns {date},QG-P1,tenant-isolation,,Basic: Feature flags;Advanced: Full experimentation platform,feature-toggle-patterns,tenant-patterns-guide.md,experimentation,production
llmops,LLMOps,ai-ops,Use when: llm lifecycle management,"model lifecycle,versioning,monitoring",LLM lifecycle management,model-registry;evaluation;deployment;monitoring,What models in use?;Version management strategy?;Model performance monitoring?,LLMOps best practices {date};ML model versioning {date},QG-M3,ai-runtime,,Basic: Model versioning;Advanced: Full MLOps pipeline,llmops;llm-versioning,ai-runtime-patterns-guide.md,llmops,solutioning
disaster-recovery,Disaster Recovery,operations,Use for operational concerns: business continuity,"backup,restore,business continuity",Business continuity,backup;restore;failover;geo-redundancy,What RPO/RTO targets?;Geo-redundancy needed?;Tenant-scoped recovery?,SaaS disaster recovery {date};multi-tenant backup patterns {date},QG-P1,tenant-isolation,,Basic: Regular backups;Advanced: Active-active geo,disaster-recovery,operations-patterns-guide.md,disaster-recovery,production
local-dev,Local Development,development,Use for development: developer environment,"developer experience,setup,tooling",Developer environment,containers;mocks;fixtures;seeding,What local setup complexity acceptable?;Multi-tenant simulation?;AI agent testing locally?,local development multi-tenant {date};developer experience patterns {date},none,tenant-isolation,,Basic: Docker compose;Advanced: Full tenant simulation,local-development-setup;parallel-development-guide,architecture-patterns-guide.md,local-dev,anytime
rate-limiting,Rate Limiting,operations,Use for operational concerns: per-tenant rate limiting,"high traffic variance,API abuse,resource exhaustion",Per-tenant rate limiting,token-bucket;sliding-window;fixed-window;adaptive,What rate limits per tier?;Burst handling needed?;Per-endpoint vs global limits?,rate limiting multi-tenant SaaS {date};token bucket per-tenant {date},QG-P1,tenant-routing,,Basic: Fixed rate per tenant;Advanced: Adaptive rate limiting with tier awareness,rate-limiting;api-gateway-patterns,operations-patterns-guide.md,rate-limiting,production
quota-management,Quota Management,monetization,Use for billing/metering: usage quota enforcement,"tier limits,usage caps,overage handling",Usage quota enforcement,hard-limit;soft-limit;overage-billing;throttle,What quota dimensions to enforce?;Overage billing or throttle?;Grace periods?,quota management SaaS {date};usage quota enforcement patterns {date},QG-P1,usage-metering,,Basic: Hard limits with blocking;Advanced: Soft limits with overage billing,quota-management;billing-integration-patterns,cost-patterns-guide.md,quota-management,production
tenant-routing,Tenant Routing,tenant-isolation,Use when: request routing to tenant context,"request routing,context switching,connection pooling",Request routing to tenant context,header-based;subdomain-based;path-based;token-based,How is tenant identified?;Connection pool strategy?;Caching strategy?,multi-tenant request routing {date};tenant context middleware {date},QG-M2,tenant-isolation,,Basic: Header-based routing;Advanced: Intelligent routing with connection pooling,tenant-routing;multi-tenant-patterns,tenant-patterns-guide.md,tenant-routing,solutioning
tenant-context-propagation,Context Propagation,tenant-isolation,Use when: context flow through services,"context passing,async context,distributed tracing",Context flow through services,thread-local;async-context;correlation-id;baggage,How to propagate across async boundaries?;Distributed tracing integration?;Context serialization?,tenant context propagation async {date};distributed context multi-tenant {date},QG-M2,tenant-routing,,Basic: Thread-local context;Advanced: Full async context with distributed tracing,context-propagation-patterns;observability,tenant-patterns-guide.md,tenant-context-propagation,solutioning
cost-tracking,Cost Tracking,monetization,Use for billing/metering: cost attribution per tenant,"cost allocation,resource attribution,billing data",Cost attribution per tenant,resource-tagging;usage-based;time-based;request-based,What cost dimensions to track?;Real-time or batch attribution?;Shared resource allocation?,cost allocation multi-tenant SaaS {date};tenant cost attribution {date},QG-P1,usage-metering;observability,,Basic: Request-based tracking;Advanced: Full resource attribution with shared cost allocation,cost-tracking;usage-metering,cost-patterns-guide.md,cost-tracking,production
performance-isolation,Performance Isolation,operations,Use for operational concerns: noisy neighbor prevention,"resource contention,performance variance,fair scheduling",Noisy neighbor prevention,resource-limits;priority-queues;fair-scheduling;isolation-pools,What resources to isolate?;Priority tiers needed?;Burst allowance?,noisy neighbor prevention {date};multi-tenant performance isolation {date},QG-I2,rate-limiting;tenant-routing,,Basic: Resource limits per tenant;Advanced: Priority-based scheduling with isolation pools,performance-isolation;rate-limiting,operations-patterns-guide.md,performance-isolation,integration
data-residency,Data Residency,compliance,"Use for compliance requirements: GDPR, data sovereignty, regional requirements","GDPR,data sovereignty,regional requirements",Geographic data storage,region-pinning;geo-routing;cross-region-sync;data-localization,What regions required?;Cross-region access patterns?;Compliance certification needs?,data residency multi-tenant SaaS {date};GDPR data sovereignty patterns {date},QG-P1,tenant-routing;compliance,,Basic: Region pinning at signup;Advanced: Dynamic geo-routing with compliance automation,data-residency;compliance,governance-patterns-guide.md,data-residency,production
encryption-key-management,Encryption Key Management,security,"Use when implementing cmk/kms patterns with signals: per-tenant keys,key rotation,HSM integration","per-tenant keys,key rotation,HSM integration",CMK/KMS patterns,shared-keys;per-tenant-keys;customer-managed-keys;hybrid,Who manages keys?;Rotation frequency?;HSM requirements?,per-tenant encryption keys {date};CMK multi-tenant KMS {date},QG-P1,tenant-isolation;compliance,,Basic: Shared keys with tenant isolation;Advanced: Customer-managed keys with HSM integration,encryption-patterns;compliance,security-patterns-guide.md,encryption-key-management,production
idempotency,Idempotency,architecture,Use when: idempotent api operations,"duplicate requests,retry safety,API reliability",Idempotent API Operations,idempotency-keys;request-deduplication;at-least-once-delivery,What retry patterns needed?;How to handle duplicate requests?;Idempotency key storage?,{date} idempotency patterns REST API;{date} idempotent operations distributed systems,QG-M1,api-gateway,,Basic: Idempotency keys in headers;Advanced: Distributed deduplication with TTL,api-gateway-patterns;event-driven-patterns,architecture-patterns-guide.md,idempotency,solutioning
caching-strategy,Caching Strategy,operations,Use for operational concerns: multi-level caching,"high read volume,response latency,tenant data caching",Multi-Level Caching,local-cache;distributed-cache;cdn;write-through;write-behind,What cache invalidation strategy?;Per-tenant cache isolation?;Cache warming needed?,{date} multi-tenant caching patterns;{date} cache invalidation strategies SaaS,QG-M2,tenant-routing,,Basic: Simple key-value cache;Advanced: Multi-level with tenant-aware invalidation,rate-limiting;performance-isolation,operations-patterns-guide.md,caching-strategy,solutioning
background-jobs,Background Jobs,operations,Use for operational concerns: tenant-aware async jobs,"async processing,long-running tasks,scheduled work",Tenant-Aware Async Jobs,queue-based;scheduled;event-triggered;batch-processing,How to propagate tenant context?;Job priority per tier?;Retry and dead-letter handling?,{date} tenant-aware background jobs;{date} async job processing multi-tenant,QG-M3,event-driven,,Basic: Simple queue with tenant header;Advanced: Priority queues with tenant context propagation,event-driven-patterns;tenant-routing,operations-patterns-guide.md,background-jobs,solutioning
file-storage,File Storage,tenant,Use for tenant management: tenant-scoped file storage,"blob storage,file uploads,document management",Tenant-Scoped File Storage,bucket-per-tenant;prefix-isolation;metadata-tagging;signed-urls,What isolation level for files?;CDN distribution needed?;Lifecycle policies per tenant?,{date} tenant isolated file storage;{date} multi-tenant blob storage patterns,QG-M2,tenant-isolation,,Basic: Prefix-based isolation;Advanced: Bucket-per-tenant with cross-region replication,tenant-isolation;data-residency,tenant-patterns-guide.md,file-storage,solutioning
session-management,Session Management,security,"Use when implementing tenant session management with signals: tenant sessions,session isolation,SaaS sessions","tenant sessions,session isolation,SaaS sessions",Tenant Session Management,scoped-sessions;session-per-tenant;shared-session-store,What compliance requirements apply?;Session timeout policies?;Cross-device session handling?,{date} multi-tenant session management;{date} session isolation SaaS,QG-M2,tenant-isolation,,Basic: Tenant-scoped session tokens;Advanced: Full session isolation with compliance audit,tenant-isolation;compliance,security-patterns-guide.md,session-management,solutioning
webhook-delivery,Webhook Delivery,integration,"Use when integrating modules with webhooks, event delivery, tenant notifications","webhooks,event delivery,tenant notifications",Tenant Webhook Delivery,at-least-once;exactly-once;retry-queues,Delivery guarantees needed?;Retry strategy?;Dead letter handling?,{date} webhook delivery patterns;{date} tenant webhook management,QG-I1,event-driven,,Basic: At-least-once with retries;Advanced: Exactly-once with idempotency,event-driven-patterns;tenant-routing,integration-patterns-guide.md,webhook-delivery,integration
api-throttling,Api Throttling,operations,Use for operational concerns: api throttling per tenant,"rate limits,API abuse,tenant quotas",API Throttling per Tenant,fixed-window;sliding-window;token-bucket;adaptive,What rate limits per tier?;Burst handling needed?;Per-endpoint vs global limits?,{date} API throttling multi-tenant;{date} tenant rate limiting patterns,QG-M2,tenant-routing,,Basic: Fixed rate limits per tenant;Advanced: Adaptive throttling with tier awareness,rate-limiting;quota-management,operations-patterns-guide.md,api-throttling,solutioning
data-archival,Data Archival,operations,Use for operational concerns: tenant data archival,"data retention,archival policies,tenant lifecycle",Tenant Data Archival,time-based;storage-based;compliance-based;tiered,What retention periods required?;Archive vs delete?;Retrieval requirements?,{date} data archival multi-tenant;{date} tenant data lifecycle,QG-I2,compliance,,Basic: Time-based archival policies;Advanced: Compliance-driven with retrieval SLAs,compliance;saas-lifecycle,operations-patterns-guide.md,data-archival,integration
notification-system,Notification System,integration,"Use when integrating modules with notifications, alerts, tenant messaging","notifications,alerts,tenant messaging",Multi-Tenant Notifications,email;push;in-app;multi-channel,What channels needed?;Tenant customization?;Delivery tracking?,{date} multi-tenant notifications;{date} SaaS notification patterns,QG-I1,event-driven,,Basic: Email notifications;Advanced: Multi-channel with tenant preferences,event-driven-patterns;tenant-routing,integration-patterns-guide.md,notification-system,integration
search-indexing,Search Indexing,operations,Use for operational concerns: tenant search indexing,"search,indexing,tenant isolation",Tenant Search Indexing,shared-index;index-per-tenant;filtered-search,What search capabilities needed?;Index isolation requirements?;Real-time vs batch indexing?,{date} multi-tenant search indexing;{date} Elasticsearch tenant isolation,QG-M2,tenant-isolation,,Basic: Filtered search on shared index;Advanced: Index-per-tenant with custom analyzers,tenant-isolation;performance-isolation,operations-patterns-guide.md,search-indexing,solutioning
circuit-breaker,Circuit Breaker,architecture,Use when: circuit breaker patterns,"resilience,fault tolerance,distributed systems",Circuit Breaker Patterns,closed;open;half-open;bulkhead,What failure scenarios to handle?;Recovery strategy?;Fallback behavior?,{date} circuit breaker patterns;{date} resilience patterns microservices,QG-M1,resilience,,Basic: Simple circuit breaker;Advanced: Hierarchical with bulkhead isolation,agent-resilience-patterns;api-gateway-patterns,architecture-patterns-guide.md,circuit-breaker,solutioning
retry-policies,Retry Policies,architecture,Use when: retry and backoff policies,"retries,backoff,transient failures",Retry and Backoff Policies,immediate;linear;exponential;jitter,What retry limits?;Backoff strategy?;Idempotency requirements?,{date} retry patterns distributed systems;{date} exponential backoff best practices,QG-M1,event-driven,,Basic: Exponential backoff;Advanced: Adaptive with circuit breaker integration,agent-resilience-patterns;event-driven-patterns,architecture-patterns-guide.md,retry-policies,solutioning
mcp-server-isolation,Mcp Server Isolation,ai,Use for AI/agent workloads requiring mcp server tenant isolation,"MCP server,tenant context,tool isolation",MCP Server Tenant Isolation,shared-server;tenant-server;hybrid-mcp,What MCP servers needed?;Tenant context propagation?;Tool permission model?,{date} MCP server multi-tenant;{date} Model Context Protocol isolation,QG-M3,tool-execution,,Basic: Shared MCP with tenant filter;Advanced: Per-tenant MCP instances,tool-execution;agent-runtime-patterns,ai-runtime-patterns-guide.md,mcp-server-isolation,solutioning
mcp-client-patterns,Mcp Client Patterns,ai,Use for AI/agent workloads requiring mcp client integration,"MCP client,agent integration,tool discovery",MCP Client Integration,direct-client;pooled-client;gateway-client,How to discover MCP tools?;Connection pooling strategy?;Client lifecycle management?,{date} MCP client patterns;{date} Model Context Protocol integration,QG-M3,mcp-server-isolation,,Basic: Direct client per agent;Advanced: Connection pooling with tenant routing,tool-execution;agent-runtime-patterns,ai-runtime-patterns-guide.md,mcp-client-patterns,solutioning
agent-coordination,Agent Coordination,ai,Use for AI/agent workloads requiring multi-agent coordination,"multi-agent,collaboration,orchestration",Multi-Agent Coordination,sequential;parallel;hierarchical;swarm,How many agents needed?;Communication protocol?;Coordination complexity?,{date} multi-agent coordination patterns;{date} agent swarm orchestration,QG-M3,ai-runtime,,Basic: Sequential handoff;Advanced: Swarm with emergent behavior,agent-runtime-patterns;event-driven-patterns,ai-runtime-patterns-guide.md,agent-coordination,solutioning
agent-negotiation,Agent Negotiation,ai,Use for AI/agent workloads requiring agent negotiation protocols,"consensus,voting,conflict resolution",Agent Negotiation Protocols,voting;auction;contract-net;consensus,How to resolve agent conflicts?;Voting mechanism?;Consensus threshold?,{date} agent negotiation protocols;{date} multi-agent consensus,QG-M3,agent-coordination,,Basic: Simple majority voting;Advanced: Contract net with utility functions,multi-agent-coordination;saga-orchestration-patterns,ai-runtime-patterns-guide.md,agent-negotiation,solutioning
model-fine-tuning,Model Fine Tuning,ai-lifecycle,Use when: design tenant-specific model fine-tuning,"tenant data isolation,training quotas,model versioning",Design tenant-specific model fine-tuning,LoRA;QLoRA;full-fine-tuning;adapter-tuning,What fine-tuning method?;Tenant data isolation level?;Training quota management?,LLM fine-tuning multi-tenant {date};model training isolation patterns {date},QG-M3,ai-runtime,,Basic: Shared fine-tuning;Advanced: Tenant-isolated training pipelines,model-fine-tuning-guide;llmops,ai-lifecycle-patterns-guide.md,model-fine-tuning,solutioning
model-deployment,Model Deployment,ai-lifecycle,Use when: safe model deployment pipeline,"canary deployment,tenant rollout,rollback procedures",Safe model deployment pipeline,blue-green;canary;ring-deployment;shadow,Rollout strategy per tenant tier?;Rollback automation?;A/B testing needed?,model deployment pipeline {date};ML model release strategies {date},QG-AI1,model-fine-tuning,,Basic: Blue-green deployment;Advanced: Per-tenant canary with automatic rollback,llm-versioning;llmops,ai-lifecycle-patterns-guide.md,model-deployment,solutioning
